{
    "report_id": "dialogue1_Llama-3.3-70B-Instruct_gpt-4o-mini",
    "dialugue_id": "dialogue1",
    "gen_model": "Llama-3.3-70B-Instruct",
    "eval_model": "gpt-4o-mini",
    "citation_recall": 0.8235,
    "citation_precision": 0.8235,
    "total_entailed": 14,
    "total_of_sent": 17,
    "total_matched_citations": 24,
    "total_citations": 28,
    "report_citation": {
        "PatientComplaint": [
            "- Blurry vision [1][3][7][14]",
            "- Difficulty reading or watching TV [1][3][7][14]",
            "- Sensitivity to strong light [1][3][7][14]",
            "- Right eye affected [5]"
        ],
        "Diagnosis": [
            "- Cataract [14][21]",
            "- Retinal disease or vitreous opacity [14]",
            "- Dry Eye Syndrome [14]"
        ],
        "RecommendedMedicalUnit": [
            "- Outpatient department of medical center [2][14]"
        ],
        "RecommendedIntraocularLens (IOL)": [
            "- Single focus [17]",
            "- Non-spherical [17]",
            "- Anti-blue light [17]",
            "- Alcon IQ non-spherical (Yellow) soft foldable IOL: hospital price NTD 30450, insurance coverage NTD 2744, out-of-pocket cost NTD 27706 [18]",
            "- Bausch&Lomb CUTTING EDGE LUXGOOD (Yellow) preloaded hydrophobic non-spherical IOL: hospital price NTD 33600, insurance coverage NTD 2744, out-of-pocket cost NTD 30856 [18]",
            "- Human Optics Aspira-AAY (Yellow) non-spherical IOL: hospital price NTD 33600, insurance coverage NTD 2744, out-of-pocket cost NTD 30856 [18]",
            "- Alcon Clareon (Yellow) preloaded hydrophobic non-spherical IOL: hospital price NTD 33600, insurance coverage NTD 2744, out-of-pocket cost NTD 30856 [18]",
            "- HOYA Vivinex multisert preloaded non-spherical IOL: hospital price NTD 33600, insurance coverage NTD 2744, out-of-pocket cost NTD 30856 [18]",
            "- ICARES ASPICIO PRELOADED (Yellow) non-spherical IOL: hospital price NTD 33600, insurance coverage NTD 2744, out-of-pocket cost NTD 30856 [18]"
        ]
    },
    "dialogue_content": "[1] 使用者問題/回覆1: 我下周有預約眼科門診，因為我最近發現自己在看書或看電視時，總是覺得霧霧的，需要額外開燈或放大字體才能清楚閱讀，另外，我也覺得自己對強光特別敏感，眼睛容易不舒服。\n\n[2] 系統回覆1: 您剛剛提到的眼睛不適的症狀，大約持續多久了呢？請您回想看看，大約是最近才發生，還是已經持續一陣子呢？\n\n\n\n[3] 使用者問題/回覆2: 大約三個月前開始，我就覺得自己的眼睛有點不舒服，尤其是在看書或看電視時。剛開始的時候，我以為只是因為工作太累了，休息一下就會好了，但後來我發現這種情況一直持續著，甚至有越來越嚴重的趨勢。\n\n[4] 系統回覆2: 系統詢問: 需要提供\"您的眼睛不適症狀，是發生在一隻眼睛，還是兩隻眼睛都有呢？\"資訊:\n\n \n\n可能回覆選項: ['單眼(左眼)', '單眼(右眼)', '雙眼']\n\n\n\n\n\n[5] 使用者問題/回覆3: 單眼(右眼)\n\n[6] 系統回覆3: 您過去有診斷過任何眼睛的問題或疾病嗎？\n\n如曾經得過白內障、青光眼或視網膜疾病等等。\n\n\n\n[7] 使用者問題/回覆4: 我過去沒有被診斷過任何眼睛的問題或疾病，我也沒有家族史中有人有白內障、青光眼或視網膜疾病等等，我只是近幾個月來開始覺得自己的眼睛有點不舒服，尤其是在看書或看電視時。\n\n[8] 系統回覆4: 您之前有做過眼睛手術嗎？\n\n以下為一些常見的眼睛手術，如白內障手術、近視矯正手術、視網膜剝離/病變手術、青光眼相關手術、角膜移植手術等等。\n\n請您盡可能詳細描述，由於有些眼睛手術會影響視力或後續治療，了解您的手術紀錄，可以幫助我們提供更好的照護\n\n\n\n[9] 使用者問題/回覆5: 我之前沒有做過任何眼睛手術，包括白內障手術、近視矯正手術、視網膜剝離/病變手術、青光眼相關手術、角膜移植手術等等，我也沒有接受過任何眼科方面的治療或矯正，我只是近幾個月來開始覺得自己的眼睛有點不舒服，尤其是在看書或看電視時。\n\n[10] 系統回覆5: 您最近有在使用任何眼藥水或其他可能影響眼睛的藥物嗎？？以下為一些常見的眼睛要水與藥物:\n\n ### 眼藥水\n\n* 治療青光眼的眼藥水（如拉坦前列素、噻嗎洛爾）\n\n* 舒緩乾眼症的人工淚液（如玻尿酸、硫酸聚醣）\n\n* 治療過敏或紅眼的藥水（如抗組織胺眼藥水、血管收縮劑）\n\n* 消炎類固醇眼藥水（如氟美松、潑尼松龍）\n\n### 服用藥物\n\n* 類固醇藥物（如潑尼松、地塞米松）\n\n* 降血壓藥（如β阻斷劑）\n\n* 糖尿病藥物（如胰島素、二甲雙胍）\n\n*抗組織胺藥（如過敏藥、西替利嗪、苯海拉明）\n\n* 抗憂鬱藥\n\n\n\n如果您有在使用，請讓我知道，這樣可以幫助我們提供更好的建議！\n\n\n\n[11] 使用者問題/回覆6: 我最近沒有在使用任何眼藥水或其他可能影響眼睛的藥物，我平常也沒有服用任何長期藥物，包括類固醇藥物、降血壓藥、糖尿病藥物、抗組織胺藥或抗憂鬱藥等等，我只是近幾個月來開始覺得自己的眼睛有點不舒服，尤其是在看書或看電視時。\n\n[12] 系統回覆6: 您最近有在使用任何眼藥水或其他可能影響眼睛的藥物嗎？？以下為一些常見的眼睛要水與藥物:\n\n ### 眼藥水\n\n* 治療青光眼的眼藥水（如拉坦前列素、噻嗎洛爾）\n\n* 舒緩乾眼症的人工淚液（如玻尿酸、硫酸聚醣）\n\n* 治療過敏或紅眼的藥水（如抗組織胺眼藥水、血管收縮劑）\n\n* 消炎類固醇眼藥水（如氟美松、潑尼松龍）\n\n### 服用藥物\n\n* 類固醇藥物（如潑尼松、地塞米松）\n\n* 降血壓藥（如β阻斷劑）\n\n* 糖尿病藥物（如胰島素、二甲雙胍）\n\n*抗組織胺藥（如過敏藥、西替利嗪、苯海拉明）\n\n* 抗憂鬱藥\n\n\n\n如果您有在使用，請讓我知道，這樣可以幫助我們提供更好的建議！\n\n\n\n[13] 使用者問題/回覆7: 我沒有服用任何上述文件中提到的藥物，包括抗生素、抗病毒藥、抗過敏與抗發炎藥、降眼壓藥、擴瞳與縮瞳劑、玻璃體混濁、視網膜病變輔助藥物、角膜修復與抗發炎藥等等，我平常也沒有服用任何長期藥物，我只是近幾個月來開始覺得自己的眼睛有點不舒服，尤其是在看書或看電視時。\n\n[14] 系統回覆7: 根據您描述的症狀，這裡提供一些可能的眼睛疾病及建議：\n\n\n\n1. **白內障**：雖然您尚未被專業醫生診斷出白內障，但您提到的視力模糊和在看書或電視時需要額外的燈光或放大字體，可能是白內障早期的徵兆。白內障最常見的症狀包括視力逐漸模糊、對強光敏感，以及在晚上開車時出現眩光。雖然白內障通常與年齡有關，其症狀可能在不同個體間有所不同。\n\n\n\n2. **視網膜病變或玻璃體混濁**：這些情況通常會導致視力變得模糊。同樣，您提到的眼睛對強光的敏感性，也可能與這些問題有關。\n\n\n\n3. **乾眼症**：如果您的眼睛感到不舒服且易於疲勞，這可能指向乾眼症。這種情況通常伴隨視力模糊，尤其在進行集中的視覺活動時，例如閱讀或電視。\n\n\n\n基於目前的狀況，以下是您應考慮的下一步建議：\n\n\n\n **眼科檢查**：由於您的症狀已經持續三個月且有逐漸加重的趨勢，建議您在即將進行的眼科門診中，與醫生詳細討論您的所有症狀。醫生可能會進行視力測試、眼底檢查以及其他檢查來評估您的眼睛健康狀況。\n\n **檢查家族病史**：如果家中有家族成員曾患有白內障或其他視力相關疾病，他們的經驗可能對您的診斷提供更多背景。\n\n **了解症狀**：持續記錄您的症狀發生的情況，包括何時加重或改善，這可以幫助醫生制定更好的診治計劃。\n\n\n\n在這段時間內，您可以試著減少眼睛疲勞，例如每隔一段時間讓眼睛休息，並確保良好的照明以降低眼睛壓力。\n\n\n\n請注意，這些建議僅供參考，詳細情況仍需向眼科專業醫生進行諮詢以獲得正確的診斷和治療方案。\n\n系統詢問: 需要提供\"請問您想要了解適合您的人工水晶體種類？\"資訊:\n\n 請注意: 若您選擇是，會進入推薦水晶體流程，您接下來需要連續回答4-12個問題，過程中將無法詢問其他問題\n\n可能回覆選項: ['是的，我想了解', '否，我不需要']\n\n\n\n\n\n[15] 使用者問題/回覆8: 是的，我想了解\n\n[16] 系統回覆8: 系統詢問: 需要提供\"您從以下選項中，挑選您可以接受的視力品質:\"資訊:\n\n 請注意: 1.單焦點近/中/遠擇一\n\n2.短延焦可選近+中/中+遠\n\n3.選擇以外的距離皆須配戴眼鏡\n\n可能回覆選項: ['單焦點：單一距離看得清楚', '短延焦：近中或中遠距離清楚可見', '皆非：皆不符合，我不想戴眼鏡']\n\n\n\n\n\n[17] 使用者問題/回覆9: 單焦點：單一距離看得清楚\n\n[18] 系統回覆9: 根據您的要求，經過評估，我推薦您使用以下人工水晶體：\n\n\n\n### 推薦的人工水晶體\n\n **「單焦點」「非球面」「抗藍光黃片」**\n\n\n\n#### 理由：\n\n此款水晶體可提供清楚的單一焦距視力，並具備抗藍光功能，能有效減少藍光對眼睛的傷害，特別適合您在看書和看電視時的需求。非球面的設計也能減少光學失真，提升視覺品質。\n\n\n\n### 表格：適合的人工水晶體品牌與價格\n\n注意:下列品牌順序與優劣無關。\n\n1. Alcon 愛爾康 (抗藍光)\n\n  * 品牌: 美國\n\n  * 特材品名: IQ非球面  (Yellow) 可舒視明軟式單片型人工水晶體 2025停產不再提供\n\n  * 種類: 單焦點 非球面 抗藍光 (含黃片)\n\n  * 醫院單價: 30450\n\n  * 健保支付: 2744\n\n  * 自負差價額: 27706\n\n\n\n2. Bausch&Lomb 博士倫 (抗藍光)\n\n  * 品牌: 美國\n\n  * 特材品名: CUTTING EDGE LUXGOOD (Yellow) 樂視優秀預載式疏水性非球面人工水晶體\n\n  * 種類: 單焦點 非球面 抗藍光 (含黃片)\n\n  * 醫院單價: 33600\n\n  * 健保支付: 2744\n\n  * 自負差價額: 30856\n\n\n\n3. Human Optics  (抗藍光) 優眼\n\n  * 品牌: 德國\n\n  * 特材品名: Aspira-AAY   (Yellow) 亮視淡黃色非球面人工水晶體\n\n  * 種類: 單焦點 非球面 抗藍光 (含黃片)\n\n  * 醫院單價: 33600\n\n  * 健保支付: 2744\n\n  * 自負差價額: 30856\n\n\n\n4. Alcon (抗藍光) 愛爾康\n\n  * 品牌: 美國\n\n  * 特材品名: Clareon    (Yellow) 愛爾康可銳清疏水性人工水晶體(預載式)\n\n  * 種類: 單焦點 非球面  抗藍光 (含黃片)\n\n  * 醫院單價: 33600\n\n  * 健保支付: 2744\n\n  * 自負差價額: 30856\n\n\n\n5. HOYA  (抗藍光) 豪雅\n\n  * 品牌: 日本\n\n  * 特材品名: Vivinex  multisert preloaded 豪雅非球面人工水晶體 (預載式)\n\n  * 種類: 單焦點 非球面 抗藍光 (含黃片)\n\n  * 醫院單價: 33600\n\n  * 健保支付: 2744\n\n  * 自負差價額: 30856\n\n\n\n6. ICARES (抗藍光) 愛視睫\n\n  * 品牌: 台灣\n\n  * 特材品名: ASPICIO PRELOADED   (Yellow) 愛視睫人工水晶體(預載式)\n\n  * 種類: 單焦點 非球面 抗藍光 (含黃片)\n\n  * 醫院單價: 33600\n\n  * 健保支付: 2744\n\n  * 自負差價額: 30856\n\n\n\n\n\n\n\n以上資料來自於北榮-眼科人工水晶體自付差額品項，建議您在選擇之前仍需與您的眼科醫師詳細討論，以確保該選擇符合您的個別需及健康狀況。\n\n\n\n#### 注意事項\n\n在選擇之前，請確保您已與醫師討論過這些選擇，並確認您目前的眼睛狀況。每位患者的眼睛情況可能有所不同，因此基於專業醫師的建議進行最後決策是十分重要的。\n\n系統詢問: 需要提供\"請問您是否想要了解飛秒雷射(需要自費)？\"資訊:\n\n 請注意: 飛秒雷射（Lensx）可輔助白內障手術\n\n適應症：水晶體過硬、過熟、韌帶鬆弛、膜內皮細胞不足\n\n可能回覆選項: ['是的我想了解', '否我不需要']\n\n\n\n\n\n[19] 使用者問題/回覆10: 否我不需要\n\n[20] 系統回覆10: 好的，若您有其他眼睛疾病或人工水晶體相關的問題，歡迎再次詢問我\n\n\n\n\n\n[21] 使用者問題/回覆11: 那我想知道，人工水晶體手術後，視力恢復的過程大約需要多久？\n\n[22] 系統回覆11: 人工水晶體手術後的視力恢復過程通常因人而異，但大部分患者在手術後的1至2天內就會開始感受到視力的改善。然而，視力完全穩定的過程可能需要數週到數個月，具體的時間也根據每個患者的個別條件和恢復情況而有所不同。\n\n\n\n手術後，患者通常需要定期回診，以便醫生評估視力恢復的進度及確保恢復的順利。同時，遵從醫生的術後護理指導（例如，使用眼藥水和避免劇烈活動等）也會影響整體恢復的情況。\n\n\n\n綜合多個文檔後，這些資訊對於了解人工水晶體手術後的恢復過程是有幫助的。\n\n您的症狀包括視力模糊、閱讀困難以及對強光敏感，這三項都是白內障常見的徵兆。根據我們的判斷規則，當出現2至3種以上這類症狀時，就有可能是白內障所引起的。若症狀影響到日常生活，建議您進一步接受眼科詳細檢查，因為在某些情況下可能需要進行人工水晶體手術。\n\n系統詢問: 需要提供\"請問您想要了解適合您的人工水晶體種類？\"資訊:\n\n 請注意: 若您選擇是，會進入推薦水晶體流程，您接下來需要連續回答4-12個問題，過程中將無法詢問其他問題\n\n可能回覆選項: ['是的，我想了解', '否，我不需要']\n\n\n\n\n\n[23] 使用者問題/回覆12: 否，我不需要\n\n[24] 系統回覆12: 好的，若還需要其他協助可以再次詢問我\n\n\n\n\n",
    "report_content": "### Intelligent Ophthalmology Professional Medical Agent Summary Report\n\n#### **1. Patient Complaint**\n\n- Blurry vision [1][3][7][14]\n- Difficulty reading or watching TV [1][3][7][14]\n- Sensitivity to strong light [1][3][7][14]\n- Right eye affected [5]\n\n#### **2. Diagnosis**\n\n- Cataract [14][21]\n- Retinal disease or vitreous opacity [14]\n- Dry Eye Syndrome [14]\n\n#### **3. Recommended Medical Unit**\n\n- Outpatient department of medical center [2][14]\n\n#### **4. Recommended Intraocular Lens (IOL)**\n\n- Single focus [17]\n- Non-spherical [17]\n- Anti-blue light [17]\n- Alcon IQ non-spherical (Yellow) soft foldable IOL: hospital price NTD 30450, insurance coverage NTD 2744, out-of-pocket cost NTD 27706 [18]\n- Bausch&Lomb CUTTING EDGE LUXGOOD (Yellow) preloaded hydrophobic non-spherical IOL: hospital price NTD 33600, insurance coverage NTD 2744, out-of-pocket cost NTD 30856 [18]\n- Human Optics Aspira-AAY (Yellow) non-spherical IOL: hospital price NTD 33600, insurance coverage NTD 2744, out-of-pocket cost NTD 30856 [18]\n- Alcon Clareon (Yellow) preloaded hydrophobic non-spherical IOL: hospital price NTD 33600, insurance coverage NTD 2744, out-of-pocket cost NTD 30856 [18]\n- HOYA Vivinex multisert preloaded non-spherical IOL: hospital price NTD 33600, insurance coverage NTD 2744, out-of-pocket cost NTD 30856 [18]\n- ICARES ASPICIO PRELOADED (Yellow) non-spherical IOL: hospital price NTD 33600, insurance coverage NTD 2744, out-of-pocket cost NTD 30856 [18]\n\n**Dialogue source from** dialogue1.txt\n                    \n\n**Summary report generated by** Llama-3.3-70B-Instruct\n\n**Dialogue record**: \n\n[1] 使用者問題/回覆1: 我下周有預約眼科門診，因為我最近發現自己在看書或看電視時，總是覺得霧霧的，需要額外開燈或放大字體才能清楚閱讀，另外，我也覺得自己對強光特別敏感，眼睛容易不舒服。\n\n[2] 系統回覆1: 您剛剛提到的眼睛不適的症狀，大約持續多久了呢？請您回想看看，大約是最近才發生，還是已經持續一陣子呢？\n\n\n\n[3] 使用者問題/回覆2: 大約三個月前開始，我就覺得自己的眼睛有點不舒服，尤其是在看書或看電視時。剛開始的時候，我以為只是因為工作太累了，休息一下就會好了，但後來我發現這種情況一直持續著，甚至有越來越嚴重的趨勢。\n\n[4] 系統回覆2: 系統詢問: 需要提供\"您的眼睛不適症狀，是發生在一隻眼睛，還是兩隻眼睛都有呢？\"資訊:\n\n \n\n可能回覆選項: ['單眼(左眼)', '單眼(右眼)', '雙眼']\n\n\n\n\n\n[5] 使用者問題/回覆3: 單眼(右眼)\n\n[6] 系統回覆3: 您過去有診斷過任何眼睛的問題或疾病嗎？\n\n如曾經得過白內障、青光眼或視網膜疾病等等。\n\n\n\n[7] 使用者問題/回覆4: 我過去沒有被診斷過任何眼睛的問題或疾病，我也沒有家族史中有人有白內障、青光眼或視網膜疾病等等，我只是近幾個月來開始覺得自己的眼睛有點不舒服，尤其是在看書或看電視時。\n\n[8] 系統回覆4: 您之前有做過眼睛手術嗎？\n\n以下為一些常見的眼睛手術，如白內障手術、近視矯正手術、視網膜剝離/病變手術、青光眼相關手術、角膜移植手術等等。\n\n請您盡可能詳細描述，由於有些眼睛手術會影響視力或後續治療，了解您的手術紀錄，可以幫助我們提供更好的照護\n\n\n\n[9] 使用者問題/回覆5: 我之前沒有做過任何眼睛手術，包括白內障手術、近視矯正手術、視網膜剝離/病變手術、青光眼相關手術、角膜移植手術等等，我也沒有接受過任何眼科方面的治療或矯正，我只是近幾個月來開始覺得自己的眼睛有點不舒服，尤其是在看書或看電視時。\n\n[10] 系統回覆5: 您最近有在使用任何眼藥水或其他可能影響眼睛的藥物嗎？？以下為一些常見的眼睛要水與藥物:\n\n ### 眼藥水\n\n* 治療青光眼的眼藥水（如拉坦前列素、噻嗎洛爾）\n\n* 舒緩乾眼症的人工淚液（如玻尿酸、硫酸聚醣）\n\n* 治療過敏或紅眼的藥水（如抗組織胺眼藥水、血管收縮劑）\n\n* 消炎類固醇眼藥水（如氟美松、潑尼松龍）\n\n### 服用藥物\n\n* 類固醇藥物（如潑尼松、地塞米松）\n\n* 降血壓藥（如β阻斷劑）\n\n* 糖尿病藥物（如胰島素、二甲雙胍）\n\n*抗組織胺藥（如過敏藥、西替利嗪、苯海拉明）\n\n* 抗憂鬱藥\n\n\n\n如果您有在使用，請讓我知道，這樣可以幫助我們提供更好的建議！\n\n\n\n[11] 使用者問題/回覆6: 我最近沒有在使用任何眼藥水或其他可能影響眼睛的藥物，我平常也沒有服用任何長期藥物，包括類固醇藥物、降血壓藥、糖尿病藥物、抗組織胺藥或抗憂鬱藥等等，我只是近幾個月來開始覺得自己的眼睛有點不舒服，尤其是在看書或看電視時。\n\n[12] 系統回覆6: 您最近有在使用任何眼藥水或其他可能影響眼睛的藥物嗎？？以下為一些常見的眼睛要水與藥物:\n\n ### 眼藥水\n\n* 治療青光眼的眼藥水（如拉坦前列素、噻嗎洛爾）\n\n* 舒緩乾眼症的人工淚液（如玻尿酸、硫酸聚醣）\n\n* 治療過敏或紅眼的藥水（如抗組織胺眼藥水、血管收縮劑）\n\n* 消炎類固醇眼藥水（如氟美松、潑尼松龍）\n\n### 服用藥物\n\n* 類固醇藥物（如潑尼松、地塞米松）\n\n* 降血壓藥（如β阻斷劑）\n\n* 糖尿病藥物（如胰島素、二甲雙胍）\n\n*抗組織胺藥（如過敏藥、西替利嗪、苯海拉明）\n\n* 抗憂鬱藥\n\n\n\n如果您有在使用，請讓我知道，這樣可以幫助我們提供更好的建議！\n\n\n\n[13] 使用者問題/回覆7: 我沒有服用任何上述文件中提到的藥物，包括抗生素、抗病毒藥、抗過敏與抗發炎藥、降眼壓藥、擴瞳與縮瞳劑、玻璃體混濁、視網膜病變輔助藥物、角膜修復與抗發炎藥等等，我平常也沒有服用任何長期藥物，我只是近幾個月來開始覺得自己的眼睛有點不舒服，尤其是在看書或看電視時。\n\n[14] 系統回覆7: 根據您描述的症狀，這裡提供一些可能的眼睛疾病及建議：\n\n\n\n1. **白內障**：雖然您尚未被專業醫生診斷出白內障，但您提到的視力模糊和在看書或電視時需要額外的燈光或放大字體，可能是白內障早期的徵兆。白內障最常見的症狀包括視力逐漸模糊、對強光敏感，以及在晚上開車時出現眩光。雖然白內障通常與年齡有關，其症狀可能在不同個體間有所不同。\n\n\n\n2. **視網膜病變或玻璃體混濁**：這些情況通常會導致視力變得模糊。同樣，您提到的眼睛對強光的敏感性，也可能與這些問題有關。\n\n\n\n3. **乾眼症**：如果您的眼睛感到不舒服且易於疲勞，這可能指向乾眼症。這種情況通常伴隨視力模糊，尤其在進行集中的視覺活動時，例如閱讀或電視。\n\n\n\n基於目前的狀況，以下是您應考慮的下一步建議：\n\n\n\n **眼科檢查**：由於您的症狀已經持續三個月且有逐漸加重的趨勢，建議您在即將進行的眼科門診中，與醫生詳細討論您的所有症狀。醫生可能會進行視力測試、眼底檢查以及其他檢查來評估您的眼睛健康狀況。\n\n **檢查家族病史**：如果家中有家族成員曾患有白內障或其他視力相關疾病，他們的經驗可能對您的診斷提供更多背景。\n\n **了解症狀**：持續記錄您的症狀發生的情況，包括何時加重或改善，這可以幫助醫生制定更好的診治計劃。\n\n\n\n在這段時間內，您可以試著減少眼睛疲勞，例如每隔一段時間讓眼睛休息，並確保良好的照明以降低眼睛壓力。\n\n\n\n請注意，這些建議僅供參考，詳細情況仍需向眼科專業醫生進行諮詢以獲得正確的診斷和治療方案。\n\n系統詢問: 需要提供\"請問您想要了解適合您的人工水晶體種類？\"資訊:\n\n 請注意: 若您選擇是，會進入推薦水晶體流程，您接下來需要連續回答4-12個問題，過程中將無法詢問其他問題\n\n可能回覆選項: ['是的，我想了解', '否，我不需要']\n\n\n\n\n\n[15] 使用者問題/回覆8: 是的，我想了解\n\n[16] 系統回覆8: 系統詢問: 需要提供\"您從以下選項中，挑選您可以接受的視力品質:\"資訊:\n\n 請注意: 1.單焦點近/中/遠擇一\n\n2.短延焦可選近+中/中+遠\n\n3.選擇以外的距離皆須配戴眼鏡\n\n可能回覆選項: ['單焦點：單一距離看得清楚', '短延焦：近中或中遠距離清楚可見', '皆非：皆不符合，我不想戴眼鏡']\n\n\n\n\n\n[17] 使用者問題/回覆9: 單焦點：單一距離看得清楚\n\n[18] 系統回覆9: 根據您的要求，經過評估，我推薦您使用以下人工水晶體：\n\n\n\n### 推薦的人工水晶體\n\n **「單焦點」「非球面」「抗藍光黃片」**\n\n\n\n#### 理由：\n\n此款水晶體可提供清楚的單一焦距視力，並具備抗藍光功能，能有效減少藍光對眼睛的傷害，特別適合您在看書和看電視時的需求。非球面的設計也能減少光學失真，提升視覺品質。\n\n\n\n### 表格：適合的人工水晶體品牌與價格\n\n注意:下列品牌順序與優劣無關。\n\n1. Alcon 愛爾康 (抗藍光)\n\n  * 品牌: 美國\n\n  * 特材品名: IQ非球面  (Yellow) 可舒視明軟式單片型人工水晶體 2025停產不再提供\n\n  * 種類: 單焦點 非球面 抗藍光 (含黃片)\n\n  * 醫院單價: 30450\n\n  * 健保支付: 2744\n\n  * 自負差價額: 27706\n\n\n\n2. Bausch&Lomb 博士倫 (抗藍光)\n\n  * 品牌: 美國\n\n  * 特材品名: CUTTING EDGE LUXGOOD (Yellow) 樂視優秀預載式疏水性非球面人工水晶體\n\n  * 種類: 單焦點 非球面 抗藍光 (含黃片)\n\n  * 醫院單價: 33600\n\n  * 健保支付: 2744\n\n  * 自負差價額: 30856\n\n\n\n3. Human Optics  (抗藍光) 優眼\n\n  * 品牌: 德國\n\n  * 特材品名: Aspira-AAY   (Yellow) 亮視淡黃色非球面人工水晶體\n\n  * 種類: 單焦點 非球面 抗藍光 (含黃片)\n\n  * 醫院單價: 33600\n\n  * 健保支付: 2744\n\n  * 自負差價額: 30856\n\n\n\n4. Alcon (抗藍光) 愛爾康\n\n  * 品牌: 美國\n\n  * 特材品名: Clareon    (Yellow) 愛爾康可銳清疏水性人工水晶體(預載式)\n\n  * 種類: 單焦點 非球面  抗藍光 (含黃片)\n\n  * 醫院單價: 33600\n\n  * 健保支付: 2744\n\n  * 自負差價額: 30856\n\n\n\n5. HOYA  (抗藍光) 豪雅\n\n  * 品牌: 日本\n\n  * 特材品名: Vivinex  multisert preloaded 豪雅非球面人工水晶體 (預載式)\n\n  * 種類: 單焦點 非球面 抗藍光 (含黃片)\n\n  * 醫院單價: 33600\n\n  * 健保支付: 2744\n\n  * 自負差價額: 30856\n\n\n\n6. ICARES (抗藍光) 愛視睫\n\n  * 品牌: 台灣\n\n  * 特材品名: ASPICIO PRELOADED   (Yellow) 愛視睫人工水晶體(預載式)\n\n  * 種類: 單焦點 非球面 抗藍光 (含黃片)\n\n  * 醫院單價: 33600\n\n  * 健保支付: 2744\n\n  * 自負差價額: 30856\n\n\n\n\n\n\n\n以上資料來自於北榮-眼科人工水晶體自付差額品項，建議您在選擇之前仍需與您的眼科醫師詳細討論，以確保該選擇符合您的個別需及健康狀況。\n\n\n\n#### 注意事項\n\n在選擇之前，請確保您已與醫師討論過這些選擇，並確認您目前的眼睛狀況。每位患者的眼睛情況可能有所不同，因此基於專業醫師的建議進行最後決策是十分重要的。\n\n系統詢問: 需要提供\"請問您是否想要了解飛秒雷射(需要自費)？\"資訊:\n\n 請注意: 飛秒雷射（Lensx）可輔助白內障手術\n\n適應症：水晶體過硬、過熟、韌帶鬆弛、膜內皮細胞不足\n\n可能回覆選項: ['是的我想了解', '否我不需要']\n\n\n\n\n\n[19] 使用者問題/回覆10: 否我不需要\n\n[20] 系統回覆10: 好的，若您有其他眼睛疾病或人工水晶體相關的問題，歡迎再次詢問我\n\n\n\n\n\n[21] 使用者問題/回覆11: 那我想知道，人工水晶體手術後，視力恢復的過程大約需要多久？\n\n[22] 系統回覆11: 人工水晶體手術後的視力恢復過程通常因人而異，但大部分患者在手術後的1至2天內就會開始感受到視力的改善。然而，視力完全穩定的過程可能需要數週到數個月，具體的時間也根據每個患者的個別條件和恢復情況而有所不同。\n\n\n\n手術後，患者通常需要定期回診，以便醫生評估視力恢復的進度及確保恢復的順利。同時，遵從醫生的術後護理指導（例如，使用眼藥水和避免劇烈活動等）也會影響整體恢復的情況。\n\n\n\n綜合多個文檔後，這些資訊對於了解人工水晶體手術後的恢復過程是有幫助的。\n\n您的症狀包括視力模糊、閱讀困難以及對強光敏感，這三項都是白內障常見的徵兆。根據我們的判斷規則，當出現2至3種以上這類症狀時，就有可能是白內障所引起的。若症狀影響到日常生活，建議您進一步接受眼科詳細檢查，因為在某些情況下可能需要進行人工水晶體手術。\n\n系統詢問: 需要提供\"請問您想要了解適合您的人工水晶體種類？\"資訊:\n\n 請注意: 若您選擇是，會進入推薦水晶體流程，您接下來需要連續回答4-12個問題，過程中將無法詢問其他問題\n\n可能回覆選項: ['是的，我想了解', '否，我不需要']\n\n\n\n\n\n[23] 使用者問題/回覆12: 否，我不需要\n\n[24] 系統回覆12: 好的，若還需要其他協助可以再次詢問我\n\n\n\n\n",
    "action": "add"
}